,date,tital,user,dislike,like,rating,page_index
56,posted on 01 Aug 2020,Assistant System Engineer  in Bangalore, Anonymous路Software Development Division    ,Dislikes There are no hike in this year. ,"Likes There are no lay off in TCS, 100% job security. They are paying internet cost also due to WFH in this panademic. ",3.0,16
57,posted on 05 Aug 2020,It Analyst for 7 years in Scotia Bank Canada, Anonymous路Former Employee路Information Technology Division    ,Dislikes Not keeping the good quality people which created lot of politics.,Likes I left job in covid because my team mentally harrased me and forced me to leave my job,2.0,16
58,posted on 25 Jun 2020,Senior Associate  in Tril It Park , Anonymous路Finance & Insurance Division    ,"Dislikes Teammates are home,about training it is good and job security is awesome,no about the appraisal criteria the growth is very slow  there has been some time politics at the time of appraisal,","Likes It has been good working in covid 19 bcz we are working from home and there was no cut off in salary as other companies did also the work system was delivered to us to Ur home address with safety 
",5.0,16
59,posted on 22 Jul 2020,Process Associate  in Gandhinagar, Anonymous路BPS Division    ,"Dislikes To be honest, you will get bore after 6 months or so. As you are facing the pc most of the time doing processing. ","Likes In lockdown, we have work from home.they have provided pc to those who were not having to do their work. Even internet cost is given by the company during monthly salary.",4.0,16
60,posted on 31 Jul 2020,It Business Analyst for 1.6 years in Bengalore, Anonymous路Former Employee路Business Analysis Division    ,Dislikes No job security for payroll employees,"Likes I worked one and half year as a payroll, my manager keep telling that will convert, but it didn't happened and they removed all contract employees stating covid 19 impact, worst decision by TCS",3.0,17
61,posted on 04 Aug 2020,Assistant System Engineer Trainee  in Gurgaon, Anonymous路GGVI Division    ,Dislikes Salary increments and appraisal,Likes Supporting in every aspect,5.0,17
62,posted on 29 Jul 2020,I T Analyst  in PUNE, Anonymous路Information Technology Division    ,Dislikes Career growth and skill development is zero here,Likes Job is secured and no career growth here in TCS.,4.0,17
63,posted on 29 Jul 2020,Oracle Database Administrator  in Pune, Anonymous路Manufacturing Division    ,"Dislikes Nothing but just giving false hopes to employees. Also, not being open to employees specially contractors. ","Likes I was laid off though I was a contractor there. So, I am not sure if their motive is to keep their permanent employees happy. This is just my view. I was told there are making me permanent employee but that never happened.",2.0,17
64,posted on 26 Jul 2020,"Senior Process Associate  in Chennai, Tamil Nadu, India", Anonymous路Banking and financial  Division    ,Dislikes There is partiality in the management level especially in appraisal time. ,Likes I am very happy to work with TCS.  There  is a great opportunity to grown up my knowledge and my skills.  There is a good team i got. ,5.0,17
65,posted on 28 Jul 2020,Information Technology Analyst  in Chennai, Anonymous路Banking & Finance Division    ,Dislikes Career growth is not good.. Salary is not good for experienced candidates,Likes Totally fracturing.. I couldn't manage work life balance.. working day and night without any compensation or hike.. ,1.0,17
66,posted on 03 Aug 2020,Information And Media Operational Specialist  in Hyderabad, Anonymous路Business Process Outsourcing Division    ,Dislikes No Hikes...No benefits.. ,Likes Good at providing job security but failed in concerning employees issues and benefits. Worst at hikes,3.0,17
67,posted on 24 Mar 2020,System Engineer for 1.7 years in Japan - Hiroshima, Anonymous路Current Employee路R&D Division    ,Dislikes It's a pretty much diverse company and depth of work varies from client to client. Strict client have less freedom while lose client gives you more freedom. But in particular I think the assets management system and value usage technique should be improved in TCS. Overall it's a great company with a good work-life balance. ,"Likes It not more about the company I work for, but its all about the segment or divisions that I work for, which makes me to like the company directly or indirectly. As we work with a Japanese team, we can imbibe more of perfections and methods to solve a particular problem. Problems are pretty much every where & everyone fails at one oranother, but it all matters is how we react,respond and recover it. I have learned this more in standards of concept, techniques both in product level and management level. We have a fantastic working environment, if some one really puts learning for perfection as a priority. 
Work life balance: it's very simple hard work for 3 out of 5 days in a week and enjoy in your weekends. Hardwork here means literally hardwork. ...Read More",4.0,17
68,posted on 31 Jul 2020,Software Engineer  in Kolkata, Anonymous路Software Development Division    ,Dislikes I would request Tcs pls provide a laptop to everyone,Likes Despite covid-19 pandemic still job is secure.So TCS is the best MNC company in the world.I am proude to be working with TCS,5.0,17
69,posted on 29 Jul 2020,Business Head -greater Mumbai for 3.1 years in Mumbai, Anonymous路Current Employee路Trade Finance Division    ,Dislikes Naothing,Likes Kindly help me with the proceduresto apply a transfer from mumbai location to my home town kerala location tcs either to trivandrum or kochin tcs due to covid pandemic,5.0,18
70,posted on 23 Mar 2018,"Business Analyst for 7.4 years in Amsterdam, Netherlands", Megha Gupta路Former Employee路IT Division    ,"Dislikes - No defined career path for Business Analyst
- No scope in consulting career
- Poor middle management creates a lot of hierarchy and titles of very mediocre standards
- Training modules in company do not focus on practicality and are extremely lengthy and time consuming
- Promotions and appraisal completely depends on how your relationship was with your management
- Onsite travel opportunity is also quite a pain and RMG does not really help much and would push you into any project to meet targets
- Complete lack of involvement from top most management with employees
- Work environment completely depends on the management style and frustration of employees due above reasons.
- Can require very good political instincts to survive for long term...Read More","Likes Working in India within TCS , might offer some benefits in terms of policies like (sabbatical, maternity leaves etc). The work life balance really depends on the project in India, your onsite location and your manager.

Is good if you want to settle and job security is the highest prio.",2.0,18
71,posted on 02 Aug 2020,It Analyst for 8.5 years in Chennai, Anonymous路Information Technology Division    ,Dislikes I only dislike Management politics. TCS = GOVT company & TCS Managers = Politicians,Likes Work life balance,1.0,18
72,posted on 31 Jul 2020,It Analyst  in Bangalore, Anonymous路BFS Division    ,"Dislikes Compensation, work culture , appraisals nothing is satisfactory",Likes not supporting at all. Have been applying leaves as they could not provide device to WFH,1.0,18
73,posted on 03 Sep 2018,BPS Information Process Enabler (BPO1.1)  in Kolkata, Anonymous路Finance  Division    ,Dislikes There is really nothing to dislike bout Tcs but the management in the bpo sector needs immediate attention as I feel that the companies money is being wasted as I have observed while being there that most of the bpo 4 and above employees have absolutely no work and they should be allocated with more and more work as they are so highly paid between a scale of 50 k to 1 lakh. I have seen such employees not even touching there systems the entire day or may be a week and there wore employees who have come here for onshore transition but for some reason or the other they wore not able to do the transition and have spent more than a year doing nothing and getting a very handsome pay. Please give work to these employees as their behavior is affecting the work all round the floor who are giving there entire effort day and night and getting 7 k to 13 k. ...Read More,Likes Most horrible place to work.. The HR is a hiring ppl from all the slum areas as most of them are having gutka inside the floor and working on each others work item... Exams of TL s are given by the bpo 1 employees which helps them in gaining an easy access to ... Appraisal is done on the basis of liking of the employees and not by any 1 s performance.. The goal sheet fill up is a very long process and a big waste of time which I feel should be changed with immediate affect as most of the tl s don't even check what is filled by their team members. The only thing I liked about TV was salary is always on time.. Though it is really and extremely less compared to the distance and time that each employees give to reach that place....Read More,1.0,18
74,posted on 30 Jul 2020,Senior Process Associate  in Bengaluru, Anonymous路Investment banking Division    ,Dislikes Work pressure,Likes Job security is good and work culture and there is opportunity for learning and development.,5.0,18
75,posted on 25 Jul 2020,System Software Engineer  in Mumbai, Anonymous路Information Technology Division    ,Dislikes Only one thing is salary hike otherwise everything was perfect,"Likes Best company to work with.
Working with tcs was a superb experience.
Job security, lenient policies",5.0,18
76,posted on 27 Mar 2020,"Assistant Consultant for 12 years in Chennai, Tamil Nadu", Arvind Kumar路Former Employee路Computer Consultancy Division    ,"Dislikes Unfair payroll policy.
Too much of favoritism and nepotism in appraisals, onsite opportunities and promotions.
Performance is not considered for anything.
HR does not take corrective action when injustice is done to an associate by his lead or manager.
In many verticals unfit people are given higher roles and they make life of really talented people miserable.
RMG team behavior is very rude and unprofessional to associates.
Salary very less compared to other companies.
No respect for senior associates aspiring for a technical career path. ...Read More",Likes Nothing other than onsite opportunities. That is again NOT based on performance or years of experience. Too much of favoritism and nepotism is there in that. ,1.0,18
77,posted on 02 Aug 2020,Team Leader  in Pune, Anonymous路Finance Division    ,"Dislikes Unfair payroll policy.
Too much of favoritism and nepotism in appraisals, onsite opportunities and promotions.
Performance is not considered for anything.
HR does not take corrective action when injustice is done to an associate by his lead or manager.
In many verticals unfit people are given higher roles and they make life of really talented people miserable.
RMG team behavior is very rude and unprofessional to associates.
Salary very less compared to other companies.
No respect for senior associates aspiring for a technical career path. ...Read More","Likes Job security is the best part of TCS, even company is taking care of the associates who are on bench during this critical time, where people are loosing their jobs in other organisations.",5.0,18
78,posted on 01 Aug 2020,Business Process Lead  in Kolkata, Anonymous路BPS Division    ,Dislikes Payscale.,"Likes Job security,  work life balance.",5.0,18
79,posted on 15 Jul 2020,Ita  in Chennai, Anonymous路Retail Division    ,,"Likes The company is open to innovation and readily adopts latest technology, I love the fact that I am a part of a team that markets reliable, high-quality products and has a global client base.
1> job security is 100% , 
2> work culture is so nice for all depend on location and project , 
3> Management is also now so fast , 
4> at-last policies are good especially health policy .",5.0,19
80,posted on 24 Jul 2020,Business Process Lead  in Vikhroli Mumbai, Anonymous路Revenue Accounting Division    ,"Dislikes Politics and long working hours. Because of long working hours, it's difficult to balance work and personal life. ",Likes TCS name itself is a brand. Working in a brand company is proud thing.,5.0,19
81,posted on 18 Jun 2020,Assistant System Engineer Trainee  in Bangalore, Anonymous路Insurance Division    ,Dislikes I dislike the politics in TCS and poor compensation that TCS provides.,"Likes I likes the job security, work life balance and company culture and learning opportunities in TCS. TCS is providing the food facility if an associate stuck in a PG without food. 

TCS has introduced Secure Boarderless workspace to work from home in this difficult times.",5.0,19
82,posted on 01 Aug 2020,Business Analyst  in Mumbai, Anonymous路BPS Division    ,Dislikes the promotion mafia which goes on in the company ,Likes They didn't cut out salary ,4.0,19
83,posted on 20 Jul 2020,Sql Database Administrator  in Chennai, Anonymous路Banking Division    ,Dislikes No support from project. Employee health is not important,"Likes Even covid-19 pandemic, they expect me to report office in my project. I refused to come, so past 3month I was in LOP. and finally they expect me to resign the job",4.0,19
84,posted on 14 May 2020,Information Process Enabler for 1.3 years in BANGALORE, Anonymous路Current Employee路Finance Division    ,"Dislikes Job security is terrible, I have been working very hard for last one year recently my Mangers  supervisor and my HR threatened me to resign from the company or else they will terminate me it seems, but I never agreed for that still the problem is not yet resolved.If someone out there who can help me please it's my humble request I need someone's help am in very difficult situation.My TL intentionally given me very low rating and they are planning to throw me out of TCS , am so depressed and stressed because of their behaviour. Requesting someone whoever sees this message please help me. NO JOB SECURITY IN TCS, wishing to be a happy and proud TCSer ....Read More","Likes Happy and proud to be a TCSer, but requesting you to please provide cab facilities to every location.Am working in Bangalore and location of my work place is SJM towers safety is very poor in the area.Hoping for BAU with the help of cab facilities in my location.",4.0,19
85,posted on 30 Jul 2020,"Senior Trainer, South Region  in Banglore", Anonymous路Csr Division    ,Dislikes Nothing. Everything is good,Likes Best thing is that they are giving opportunities to work in many ways. Learning new things is initiated..,5.0,19
86,posted on 21 May 2020,Graduate Engineer Trainee  in New Delhi, Anonymous路Internal IT Division    ,"Dislikes Things I dislike about about working here, is I don't like my project at all. They just force you to take the projects they have, they never ask about what you want to do. There salary package for Freshers makes me feel like I am an intern an not at all an employee. I am working even then I need to ask for money from my parents, this is what I hate the most. They don't even provide any transport.","Likes When I got the offer letter it was exciting to join TCS as a fresher. I have learnt a lot here, which I don't expect i could have ever learnt, on my own or any other way. During this lockdown situation they are very helpful providing us with all the possible facilities like, taking our desktops home. Providing us with the internet charges. ",3.0,19
87,posted on 01 Aug 2020,Associate  in Pune, Anonymous路Bpo Division    ,Dislikes Not yet,Likes Feeling very happy being a part of TATA group,5.0,19
88,posted on 18 Jul 2020,It Analyst  in Pune, Anonymous路Infrastructure Management Services Division    ,"Dislikes Rather than hiring new employees, company should concentrate on providing annual hikes to the present employees who without fail are working through day and night to get the job done.","Likes Like: Work-Life balance.
Covid 19 Support: Provided with company desktop to be able to work from home. Weekly calls from the HR team asking about health, both physical and mental.",3.0,19
